{
  "id": "vagrant",
  "title": "HashiCorp Vagrant",
  "summary": "Tool for building and managing virtual machine environments in a single workflow, enabling consistent development environments.",
  "category": "Infrastructure as Code",
  "tags": ["virtualization", "development-environment", "provisioning", "hashicorp", "automation"]
}